{
  "schema_version": "1.0",
  "scene_id": "forest_v1",
  "animals_enabled": true,
  "time_of_day": "sunset",
  "light_warmth": 0.7,
  "brightness": 0.8,
  "fog_density": 0.25,
  "sound": "forest",
  "master_volume": 0.6,
  "sound_layers": {
    "wind": 0.2,
    "birds": 0.3,
    "water": 0.4,
    "pad": 0.3
  },
  "motion": "gentle",
  "motion_speed": 0.2,
  "particles": [
    "fireflies"
  ],
  "orb": {
    "enabled": true,
    "breath_seconds": 5.5
  }
}
